{
  "minutes": 3,
  "sources": [
    {
      "title": "RFC 8259, section 3: Values",
      "url": "https://www.rfc-editor.org/rfc/rfc8259#section-3"
    }
  ],
  "beats": [
    {
      "key": "booleans",
      "goal": "The learner knows true and \"true\" differ.",
      "content": "true and false are booleans. \"true\" in quotes is a string."
    }
  ],
  "bug": {
    "key": "flag-type",
    "file": "flags.json",
    "code": "{\n  \"enabled\": \"true\"\n}\n",
    "explanation": "Secret explanation SX-TYPES-41: enabled held the string \"true\" instead of the boolean true.",
    "hint": "Read each value with its type.",
    "fixChecks": [
      {
        "type": "json",
        "file": "flags.json",
        "pointer": "/enabled",
        "equals": true,
        "message": "Secret fix check FX-TYPES-17 is not met yet."
      }
    ],
    "revealAfter": null
  },
  "referenceSolution": {
    "files": {},
    "bugFix": "{\n    \"enabled\": true,\n    \"_reference\": \"RS-TYPES-88\"\n}\n"
  }
}
